R622279,520010066901,CC,5249642,,2,3000005000079,BARRERA COLOSTOMIA No 70mm R/401613,1,32000,32000
R622279,520010066901,CC,5249642,,2,3000005000087,BOLSA DRENAJE P/COLOSTOMIA No.70mm R/402535 SURFIT,1,17000,17000
R622279,520010066901,CC,5249642,,2,3000005000907,PASTA STOMAHESIVE X 2 ONZAS REF.183910,1,94500,94500
R620133,520010066901,RC,1081284666,,3,S11304,INTERNACION EN SERVICIO DE COMPLEJIDAD ALTA- HABITACION DE,1,72300,72300
R620133,520010066901,RC,1081284666,,2,3000005000007,ADAPTADOR C/VALVULA REF/415111,1,4500,4500
R620133,520010066901,RC,1081284666,,2,3000005000167,CATHETER INTRAVENOSO No.22G x 1,1,3200,3200
R620133,520010066901,RC,1081284666,,2,3000005000967,EQUIPO DE BOMBA ESTANDAR VL-ST01 FRESENIUS,1,34000,34000
