R636652,520010066901,CC,36757241,,2,3000020000027,SONDA NELATON No. 6,1,1300,1300
R636652,520010066901,CC,36757241,,2,3000055000005,JERINGA DESECHABLE 10ml 21G x 1 1/2,1,700,700
R636652,520010066901,CC,36757241,,2,3010005000334,FRASCO RECOLECTOR DE ORINA M/NACIONAL,1,572,572
R636653,520010066901,CC,36757241,,2,3000005000002,EQUIPO DE MACROGOTEO SIN AGUJA VENOCLISIS,1,3000,3000
R636653,520010066901,CC,36757241,,2,3000005001017,APOSITO TRANS P/FIJACION DE CATHETER 5.1CM * 7CM,1,3250,3250
R636653,520010066901,CC,36757241,,2,3000010000009,CATHETER INTRAVENOSO No.18G x 1-1/4,1,3200,3200
R636653,520010066901,CC,36757241,,2,3000055000005,JERINGA DESECHABLE 10ml 21G x 1 1/2,3,700,2100
R636653,520010066901,CC,36757241,,3,S11304,INTERNACIÓN EN SERVICIO DE COMPLEJIDAD ALTA- HABITACIÓN DE C,1,215100,215100
