R703258,520010066901,CC,98428201,,3,S11304,INTERNACIÓN EN SERVICIO DE COMPLEJIDAD ALTA- HABITACIÓN DE C,1,215100,215100
R703258,520010066901,CC,98428201,,2,3000005000002,EQUIPO DE MACROGOTEO SIN AGUJA VENOCLISIS,1,3000,3000
R703258,520010066901,CC,98428201,,2,3000005001017,APOSITO TRANS P/FIJACION DE CATHETER 5.1CM * 7CM,1,3250,3250
R703258,520010066901,CC,98428201,,2,3000010000001,TAPON HEPARINIZADO DESECHABLE,1,571,571
R703258,520010066901,CC,98428201,,2,3000010000008,CATHETER INTRAVENOSO No.16G x 1-1/4,1,2400,2400
R703258,520010066901,CC,98428201,,2,3000055000005,JERINGA DESECHABLE 10ml 21G x 1 1/2,1,700,700
