R706614,520010066901,CC,30716436,,2,3000055000005,JERINGA DESECHABLE 10ml 21G x 1 1/2,1,700,700
R706921,520010066901,CC,5340679,1846550,3,S11304,INTERNACIÓN EN SERVICIO DE COMPLEJIDAD ALTA- HABITACIÓN DE C,1,215100,215100
R706921,520010066901,CC,5340679,1846550,2,3000005000002,EQUIPO DE MACROGOTEO SIN AGUJA VENOCLISIS,2,3000,6000
R706921,520010066901,CC,5340679,1846550,2,3000005001017,APOSITO TRANS P/FIJACION DE CATHETER 5.1CM * 7CM,1,3250,3250
R706921,520010066901,CC,5340679,1846550,2,3000055000005,JERINGA DESECHABLE 10ml 21G x 1 1/2,30,700,21000
R706921,520010066901,CC,5340679,1846550,2,3010005000334,FRASCO RECOLECTOR DE ORINA M/NACIONAL,1,572,572
R706921,520010066901,CC,5340679,1846550,2,3000010000009,CATHETER INTRAVENOSO No.18G x 1-1/4,1,3200,3200
