R707951,520010066901,TI,1004214312,,3,S11304,INTERNACION EN SERVICIO DE COMPLEJIDAD ALTA- HABITACION DE,1,228000,228000
R707951,520010066901,TI,1004214312,,1,3000010000009,CATHETER INTRAVENOSO No.18G x 1-1/4,1,3690,3690
R707951,520010066901,TI,1004214312,,1,3000005000002,EQUIPO DE MACROGOTEO SIN AGUJA VENOCLISIS,1,3460,3460
R707951,520010066901,TI,1004214312,,1,3000055000005,JERINGA DESECHABLE 10ml 21G x 1 1/2,9,810,7290
R707951,520010066901,TI,1004214312,,1,3000010000001,TAPON HEPARINIZADO DESECHABLE,1,660,660
R707951,520010066901,TI,1004214312,,1,3000005001017,APOSITO TRANS P/FIJACION DE CATHETER 5.1CM * 7CM,1,3740,3740
