FE3087,520010066901,CC,1086696667,205256234,2,3000010000001,TAPON HEPARINIZADO DESECHABLE,2,3289,6578
FE3087,520010066901,CC,1086696667,205256234,2,3000005001124,esparadrapo para fijacion de canulas 9x6,3,2333,6999
FE3087,520010066901,CC,1086696667,205256234,2,3000005000008,EXTENSION DE ANESTESIA ADULTO,2,5756,11512
FE3087,520010066901,CC,1086696667,205256234,2,3000010000009,CATHETER INTRAVENOSO No.18G x 1-1/4,2,2584,5168
FE3087,520010066901,CC,1086696667,205256234,2,3000005000007,EQUIPO B. ESTANDAR INTRAFIX COMPAC AIR IL 441702P,1,37117,37117
FE3087,520010066901,CC,1086696667,205256234,2,3000005000002,EQUIPO DE MACROGOTEO SIN AGUJA VENOCLISIS,1,3525,3525
FE3087,520010066901,CC,1086696667,205256234,3,10A002,INTERNACIÓN COMPLEJIDAD ALTA HABITACION BIPERSONAL,1,251300,251300
FE3087,520010066901,CC,1086696667,205256234,2,3000020000028,SONDA NELATON No. 8,1,1527,1527
