FE4651,520010066901,CC,1058971009,,2,3000020000028,SONDA NELATON No. 8,1,1557,1557
FE4651,520010066901,CC,1058971009,,2,3000010000009,CATHETER INTRAVENOSO No.18G x 1-1/4,1,3830,3830
FE4651,520010066901,CC,1058971009,,3,10A002,INTERNACIÓN COMPLEJIDAD ALTA HABITACION BIPERSONAL,3,322700,968100
FE4653,520010066901,CC,27452140,2020066064,3,10A004,INTERNACIÓN COMPLEJIDAD ALTA CUATRO O MÁS CAMAS,1,241700,241700
FE4653,520010066901,CC,27452140,2020066064,2,3000055000005,JERINGA DESECHABLE 10ml 21G x 1 1/2,2,841,1682
FE4653,520010066901,CC,27452140,2020066064,3,S55115,MATERIALES DE SUTURA Y CURACION_ AGENTES Y GASES ANESTESICOS,1,67600,67600
