FE7112,520010066901,CC,27434094,,2,3000005000002,EQUIPO DE MACROGOTEO SIN AGUJA VENOCLISIS,1,3460,3460
FE7112,520010066901,CC,27434094,,2,3000010000009,CATHETER INTRAVENOSO No.18G x 1-1/4,1,3690,3690
FE7112,520010066901,CC,27434094,,2,3000015000005,GUANTE QUIRURGICO ESTERIL 6. 1/2 (PAR),1,1270,1270
FE7112,520010066901,CC,27434094,,2,3000020000028,SONDA NELATON No. 8,1,1500,1500
FE7112,520010066901,CC,27434094,,2,3010005000334,FRASCO RECOLECTOR DE ORINA M/NACIONAL,1,660,660
FE7112,520010066901,CC,27434094,,3,S20200,SALA DE OBSERVACION (URGENCIAS) DE COMPLEJIDAD ALTA SOD,1,51324,51324
