FE9385,520010066901,CC,1004728305,,2,3000005000002,EQUIPO DE MACROGOTEO SIN AGUJA VENOCLISIS,1,3591,3591
FE9385,520010066901,CC,1004728305,,2,3000010000009,CATHETER INTRAVENOSO No.18G x 1-1/4,1,3830,3830
FE9385,520010066901,CC,1004728305,,2,3000055000005,JERINGA DESECHABLE 10ml 21G x 1 1/2,3,841,2523
FE9384,520010066901,CC,21458957,,2,3000010000009,CATHETER INTRAVENOSO No.18G x 1-1/4,1,3830,3830
FE9384,520010066901,CC,21458957,,2,3000005000002,EQUIPO DE MACROGOTEO SIN AGUJA VENOCLISIS,1,3591,3591
FE9384,520010066901,CC,21458957,,2,3000055000005,JERINGA DESECHABLE 10ml 21G x 1 1/2,3,841,2523
