FE9986,520010066901,CC,1004572842,206988064,2,3000010000009,CATHETER INTRAVENOSO No.18G x 1-1/4,3,2674,8022
FE9986,520010066901,CC,1004572842,206988064,2,3000005001017,APOSITO TRANS P/FIJACION DE CATHETER 6CM * 7CM,3,3952,11856
FE9986,520010066901,CC,1004572842,206988064,2,3000005000008,EXTENSION DE ANESTESIA ADULTO,4,5957,23828
FE9986,520010066901,CC,1004572842,206988064,2,3000005000002,EQUIPO DE MACROGOTEO SIN AGUJA VENOCLISIS,1,3648,3648
FE9986,520010066901,CC,1004572842,206988064,2,3000005000007,EQUIPO B. ESTANDAR INTRAFIX COMPAC AIR IL 441702P,1,38416,38416
FE9986,520010066901,CC,1004572842,206988064,3,10A002,INTERNACIÓN COMPLEJIDAD ALTA HABITACION BIPERSONAL,1,260100,260100
