I1324361,520010066901,CC,59668218,,2,3000055000009,JERINGA DESECHABLE 5ml 21G x 1 1/2,1,716,716
I1341707,520010066901,CC,30712030,,2,3000010000010,CATHETER INTRAVENOSO No.20G x 1-1/4,1,3830,3830
I1341707,520010066901,CC,30712030,,2,3000005000008,EXTENSION DE ANESTESIA ADULTO,1,5854,5854
I1349480,520010066901,CC,27478874,,2,3000055000011,JERINGA DESECHABLE 1ml - 27G x 1/2,1,716,716
I1350382,520010066901,CC,30720818,,2,3000005000957,AGUJA PARA INSULINA 31G X 5mm ADULTO,60,1080,64800
I1350382,520010066901,CC,30720818,,2,3010005000667,LANCETAS ON CALL ADVANCE,50,519,25950
I1350382,520010066901,CC,30720818,,2,3000005001362,TIRAS REACTIVAS GLUCOSA OSMETER MATCH II,50,600,30000
