FE15133,520010066901,TI,1114813954,207997861,3,10A004,INTERNACIÓN COMPLEJIDAD ALTA CUATRO O MÁS CAMAS,1,194900,194900
FE15132,520010066901,CC,1061016061,,3,10A004,INTERNACIÓN COMPLEJIDAD ALTA CUATRO O MÁS CAMAS,1,194900,194900
FE15132,520010066901,CC,1061016061,,2,3000005000002,EQUIPO DE MACROGOTEO SIN AGUJA VENOCLISIS,2,3648,7296
FE15132,520010066901,CC,1061016061,,2,3000055000005,JERINGA DESECHABLE 10ml 21G x 1 1/2,2,851,1702
FE15132,520010066901,CC,1061016061,,2,3000010000024,LLAVE DE TRES VIAS DESECHABLE,1,5471,5471
FE15132,520010066901,CC,1061016061,,2,3000005001017,APOSITO TRANS P/FIJACION DE CATHETER 6CM * 7CM,1,3952,3952
FE15132,520010066901,CC,1061016061,,2,3000010000009,CATHETER INTRAVENOSO No.18G x 1-1/4,1,2674,2674
FE15132,520010066901,CC,1061016061,,2,3000005000008,EXTENSION DE ANESTESIA ADULTO,1,5957,5957
