FE18596,520010066901,CC,1233193317,3256799,2,3000005000002,EQUIPO DE MACROGOTEO SIN AGUJA VENOCLISIS,2,3591,7182
FE18596,520010066901,CC,1233193317,3256799,2,3000005001017,APOSITO TRANS P/FIJACION DE CATHETER 6CM * 7CM,1,3882,3882
FE18596,520010066901,CC,1233193317,3256799,2,3000010000009,CATHETER INTRAVENOSO No.18G x 1-1/4,1,3830,3830
FE18596,520010066901,CC,1233193317,3256799,2,3000010000024,LLAVE DE TRES VIAS DESECHABLE,1,5377,5377
FE18596,520010066901,CC,1233193317,3256799,2,3000055000005,JERINGA DESECHABLE 10ml 21G x 1 1/2,3,841,2523
FE18596,520010066901,CC,1233193317,3256799,3,5DSA01,DERECHOS DE SALA DE OBSERVACION EN URGENCIAS COMPLEJIDAD ALT,1,109000,109000
FE18596,520010066901,CC,1233193317,3256799,2,601T02,TRASLADO ASISTENCIAL BÁSICO TERRESTRE SECUNDARIO,1,46600,46600
FE18596,520010066901,CC,1233193317,3256799,3,10A004,INTERNACIÓN COMPLEJIDAD ALTA CUATRO O MÁS CAMAS,1,250100,250100
