FE23126,520010066901,CC,1085247621,2022000388390,1,3000005000002,EQUIPO DE MACROGOTEO SIN AGUJA VENOCLISIS,1,3772,3772
FE23126,520010066901,CC,1085247621,2022000388390,1,3000005000008,EXTENSION DE ANESTESIA ADULTO,2,6164,12328
FE23126,520010066901,CC,1085247621,2022000388390,1,3000005001017,APOSITO TRANS P/FIJACION DE CATHETER 6CM * 7CM,1,4088,4088
FE23126,520010066901,CC,1085247621,2022000388390,1,3000010000009,CATHETER INTRAVENOSO No.18G x 1-1/4,1,4025,4025
FE23126,520010066901,CC,1085247621,2022000388390,1,3000020000028,SONDA NELATON No. 8,1,1636,1636
FE23126,520010066901,CC,1085247621,2022000388390,1,3000055000005,JERINGA DESECHABLE 10ml 21G x 1 1/2,8,881,7048
FE23126,520010066901,CC,1085247621,2022000388390,3,10A004,INTERNACIÓN COMPLEJIDAD ALTA CUATRO O MÁS CAMAS,2,209000,418000
