FE27065,520010066901,CC,1082749675,,3,10A004,INTERNACIÓN COMPLEJIDAD ALTA CUATRO O MÁS CAMAS,1,91966,91966
FE27065,520010066901,CC,1082749675,,2,3000005000002,EQUIPO DE MACROGOTEO SIN AGUJA VENOCLISIS,2,3460,6920
FE27065,520010066901,CC,1082749675,,2,3000005000008,EXTENSION DE ANESTESIA ADULTO,1,5640,5640
FE27065,520010066901,CC,1082749675,,2,3000005001017,APOSITO TRANSPARENTE P/FIJACION DE CATHETER 6CM * 7CM,1,3740,3740
FE27065,520010066901,CC,1082749675,,2,3000010000009,CATHETER INTRAVENOSO No.18G x 1-1/4,1,3690,3690
FE27065,520010066901,CC,1082749675,,2,3000010000024,LLAVE DE TRES VIAS DESECHABLE,1,5180,5180
FE27065,520010066901,CC,1082749675,,2,3000055000005,JERINGA DESECHABLE 10ml 21G x 1 1/2,2,810,1620
FE27907,520010066901,CC,1085343393,,2,3000010000009,CATHETER INTRAVENOSO No.18G x 1-1/4,1,3690,3690
FE27907,520010066901,CC,1085343393,,2,3000055000005,JERINGA DESECHABLE 10ml 21G x 1 1/2,3,810,2430
