FE34080,520010066901,CC,27470362,6038885,2,3000010000009,CATHETER INTRAVENOSO No.18G x 1-1/4,1,5111,5111
FE34080,520010066901,CC,27470362,6038885,2,3000005000002,EQUIPO DE MACROGOTEO SIN AGUJA VENOCLISIS,1,2930,2930
FE34080,520010066901,CC,27470362,6038885,2,3000005001017,APOSITO TRANSPARENTE P/FIJACION DE CATHETER 6CM * 7CM,1,6610,6610
FE34080,520010066901,CC,27470362,6038885,2,3000005000008,EXTENSION DE ANESTESIA ADULTO,1,3032,3032
FE34080,520010066901,CC,27470362,6038885,3,10A002,INTERNACIÓN COMPLEJIDAD ALTA HABITACION BIPERSONAL,1,356600,356600
FE34193,520010066901,CC,1089846221,,2,3000055000009,JERINGA DESECHABLE 5ml 21G x 1 1/2,1,714,714
FE34213,520010066901,CC,8693394,5594144,2,3000005000008,EXTENSION DE ANESTESIA ADULTO,1,3032,3032
FE34213,520010066901,CC,8693394,5594144,2,3000010000009,CATHETER INTRAVENOSO No.18G x 1-1/4,1,5111,5111
