FE39066,520010066901,CC,27213368,,2,3000010000009,CATHETER INTRAVENOSO No.18G x 1-1/4,1,5622,5622
FE39066,520010066901,CC,27213368,,2,3000055000005,JERINGA DESECHABLE 10ml 21G x 1 1/2,4,1535,6140
FE39066,520010066901,CC,27213368,,2,3000005001017,APOSITO TRANSPARENTE P/FIJACION DE CATHETER 6CM * 7CM,1,7271,7271
FE39066,520010066901,CC,27213368,,2,3000005000008,EXTENSION DE ANESTESIA ADULTO,1,3335,3335
FE39066,520010066901,CC,27213368,,2,3000005000002,EQUIPO DE MACROGOTEO SIN AGUJA VENOCLISIS,1,3223,3223
FE39066,520010066901,CC,27213368,,2,3000001000031,AGUJA P/ANESTESIA ESPINAL No.18G X 3 1/4,1,36830,36830
FE39066,520010066901,CC,27213368,,2,3000055000007,JERINGA DESECHABLE 20ml 21G x 1 1/2,1,2096,2096
FE39066,520010066901,CC,27213368,,3,10A002,INTERNACIÓN COMPLEJIDAD ALTA HABITACION BIPERSONAL,1,412200,412200
