FE41030,520010066901,CC,24303214,,3,5DSA01,DERECHOS DE SALA DE OBSERVACION EN URGENCIAS COMPLEJIDAD ALT,1,134500,134500
FE41030,520010066901,CC,24303214,,2,3000010000024,LLAVE DE TRES VIAS DESECHABLE,1,2541,2541
FE41030,520010066901,CC,24303214,,2,3000010000009,CATHETER INTRAVENOSO No.18G x 1-1/4,1,5622,5622
FE41030,520010066901,CC,24303214,,2,3000005001017,APOSITO PERIFERICO ADULTO PREMIUM 6CM X 7 CM,1,7271,7271
FE41030,520010066901,CC,24303214,,2,3000005000008,EXTENSION DE ANESTESIA ADULTO,1,3335,3335
FE41030,520010066901,CC,24303214,,2,3000005000002,EQUIPO DE MACROGOTEO SIN AGUJA VENOCLISIS,2,3223,6446
FE41030,520010066901,CC,24303214,,2,3000055000005,JERINGA DESECHABLE 10ml 21G x 1 1/2,1,1535,1535
