FE40827,520010066901,CC,1087411539,,3,10A002,INTERNACIÓN COMPLEJIDAD ALTA HABITACION BIPERSONAL,1,412200,412200
FE40827,520010066901,CC,1087411539,,2,3000001000031,AGUJA P/ANESTESIA ESPINAL No.18G X 3 1/4,1,36830,36830
FE40827,520010066901,CC,1087411539,,2,3000005001358,APOSITO TEGADERM IV ADVANCED 6 5x7 cm REF1683,1,8082,8082
FE40827,520010066901,CC,1087411539,,2,3000005000002,EQUIPO DE MACROGOTEO SIN AGUJA VENOCLISIS,2,3223,6446
FE40827,520010066901,CC,1087411539,,2,3000005000008,EXTENSION DE ANESTESIA ADULTO,1,3335,3335
FE40827,520010066901,CC,1087411539,,2,3000055000005,JERINGA DESECHABLE 10ml 21G x 1 1/2,5,1535,7675
